Sno,Question,Option,Option,Option,Option,Answer,Options
1,.MOV' extension refers usually to what kind of file?,Image file,Animation/movie file,Audio file,MS Office document,Animation/movie file,"Image file,Animation/movie file,Audio file,MS Office document"
2,Which is a type of Electrically-Erasable Programmable Read-Only Memory?,Flash,Flange,Fury,FRAM,Flash,"Flash,Flange,Fury,FRAM"
3,DB' computer abbreviation usually means ?,Database,Double Byte,Data Block,Driver Boot,Database,"Database,Double Byte,Data Block,Driver Boot"
4,Changing computer language of 1's and 0's to characters that a person can understand is...,Highlight,Clip art,Decode,Execute,Decode,"Highlight,Clip art,Decode,Execute"
5,How many bits is a byte?,4,8,16,32,8,"4,8,16,32"
6,The speed of your net access is defined in terms of...,RAM,MHz,Kbps,Megabytes,Kbps,"RAM,MHz,Kbps,Megabytes"
7,Computers calculate numbers in what mode?,Decimal,Octal,Binary,None of the above,Binary,"Decimal,Octal,Binary,None of the above"
8,"The letters, ""DOS"" stand for...",Data Out System,Disk Out System,Disk Operating System,Data Operating System,Disk Operating System,"Data Out System,Disk Out System,Disk Operating System,Data Operating System"
